{
  "schema": "enz-eigenchannel-mimo/run-manifest/v2",
  "run_id": "ENZ-20260803-180323-ae961d5a",
  "status": "BUILT",
  "created_at": "2026-08-03T18:03:23.461283+00:00",
  "updated_at": "2026-08-03T18:03:59.247858+00:00",
  "completed_at": "2026-08-03T18:03:59.247858+00:00",
  "specification": {
    "path": "D:\\dev\\ENZ_ANT\\ENZ-Eigenchannel-mimo\\modelos\\especificacoes\\g0_figura2_reconstrucao_exploratoria.hipotese.v5.yaml",
    "sha256": "ae961d5a891930b6004dec7a82718cf362a60d57113f1dc19b728318de090d70",
    "bytes": 15216
  },
  "git": {
    "commit": "428d1557220e15f06057de59eb538d98af0d0732",
    "dirty": true
  },
  "host": {
    "python": "3.12.10",
    "os": "Windows-11-10.0.26200-SP0",
    "hostname": "RF01",
    "cpu_count": 20,
    "ram_bytes": 42677538816
  },
  "runtime": {
    "requested_aedt": "2024.2",
    "strict_version": true,
    "pyaedt": "1.3.0",
    "transport": "native AEDT gRPC via PyAEDT",
    "license": "DISPONIVEL: available_license_feature=99",
    "pid": 36572,
    "grpc_port": 58595,
    "build": "2024.2.0",
    "orphan_after_close": false
  },
  "solver": {
    "stage": "M4",
    "solution_type": "DrivenModal",
    "setup": "Setup_Driven_25p87_HIPOTESE",
    "solve_requested": false,
    "cores": 14,
    "tasks": 1,
    "gpus": 0,
    "validation_messages": []
  },
  "artifacts": [
    {
      "path": "input\\g0_figura2_reconstrucao_exploratoria.hipotese.v5.yaml",
      "sha256": "ae961d5a891930b6004dec7a82718cf362a60d57113f1dc19b728318de090d70",
      "bytes": 15216
    },
    {
      "path": "aedt\\G0_figura2_reconstrucao_exploratoria_M4.aedt",
      "sha256": "ea05bca635d72c73b51c784c0caf25a5e0fbe3a9b6e8b1c9589f3dfbafa1d27c",
      "bytes": 248090
    },
    {
      "path": "logs\\validation.log",
      "sha256": "e3b0c44298fc1c149afbf4c8996fb92427ae41e4649b934ca495991b7852b855",
      "bytes": 0
    },
    {
      "path": "logs\\aedt_messages.log",
      "sha256": "737f23adafdd4a630841d561d5eaf70cf4896666dc1e28a5d9e307a6dd472e7b",
      "bytes": 76
    }
  ],
  "errors": []
}
